1936,1936,3019.HK,Xtrackers - MSCI World Swap UCITS ETF,nan,HK,HKD,ETF,,,,nan,nan,,,,,,
1937,1937,302.HK,CMGE TECHNOLOGY GROUP LTD,nan,HK,HKD,Common Stock,,,,nan,nan,,,,,,
1938,1938,3020.HK,Xtrackers - MSCI USA Swap UCITS ETF,nan,HK,HKD,ETF,LU0274210672,,,nan,nan,,,,,,
1939,1939,3020-OL.HK,X DBMSCIUSA,nan,HK,HKD,Common Stock,,,,nan,nan,,,,,,
1940,1940,3023.HK,Ping An of China Trust - Ping An Nasdaq AI and Robotics ETF,nan,HK,HKD,ETF,,,,nan,nan,,,,,,
1941,1941,3024.HK,W.I.S.E. - SSE 50 China Tracker,nan,HK,HKD,ETF,HK0000052297,,,nan,nan,,,,,,
1942,1942,3027.HK,Xtrackers MSCI Russia Capped Swap UCITS ETF 2D,nan,HK,HKD,ETF,,,,nan,nan,,,,,,
1943,1943,303.HK,VTECH HOLDINGS LTD,nan,HK,HKD,Common Stock,,,,nan,nan,,,,,,
1944,1944,3032.HK,Hang Seng TECH Index ETF,nan,HK,HKD,ETF,,,,nan,nan,,,,,,
1945,1945,3033.HK,CSOP Hang Seng TECH Index ETF,Hong Kong,HK,HKD,ETF,HK0000642568,,,,,,,7.7325716,8.462888,0.0,0.0
1946,1946,3036.HK,Xtrackers MSCI Taiwan UCITS ETF 1C,nan,HK,HKD,ETF,,,,nan,nan,,,,,,
1947,1947,3040.HK,Global X MSCI China,nan,HK,HKD,ETF,,,,nan,nan,,,,,,
1948,1948,3043.HK,db x-trackers MSCI Pacific ex Japan UCITS 2C,nan,HK,HKD,ETF,,,,nan,nan,,,,,,
1949,1949,3048.HK,Xtrackers MSCI Brazil UCITS ETF 2C,nan,HK,HKD,ETF,,,,nan,nan,,,,,,
1950,1950,3049.HK,db x-trackers CSI300 UCITS 2D,nan,HK,HKD,ETF,,,,nan,nan,,,,,,
1951,1951,305.HK,WULING MOTORS HOLDINGS LTD,nan,HK,HKD,Common Stock,,,,nan,nan,,,,,,
1952,1952,3053.HK,CSOP Hong Kong Dollar Money Market ETF,nan,HK,HKD,ETF,HK0000426384,,,nan,nan,,,,,,
1953,1953,3055.HK,db x-trackers MSCI China UCITS 2C,nan,HK,HKD,ETF,,,,nan,nan,,,,,,
1954,1954,3065.HK,db x-trackers MSCI Singapore IM UCITS 2C,nan,HK,HKD,ETF,,,,nan,nan,,,,,,
1955,1955,3067.HK,iShares Hang Seng TECH ETF,Hong Kong,HK,HKD,ETF,,,,,,,,16.306286,17.81352,0.0,0.0
1956,1956,3069.HK,ChinaAMC Hang Seng Hong Kong Biotech Index ETF,nan,HK,HKD,ETF,,,,nan,nan,,,,,,
1957,1957,3070.HK,Ping An of China CSI HK Dividend ETF,nan,HK,HKD,ETF,,,,nan,nan,,,,,,
1958,1958,3072.HK,Nikko AM Global Internet ETF,nan,HK,HKD,ETF,,,,nan,nan,,,,,,
1959,1959,3073.HK,SPDR FTSE Greater China ETF,nan,HK,HKD,ETF,HK0000068749,,,nan,nan,,,,,,
1960,1960,3074.HK,iShares CORE MSCI Taiwan HKD,nan,HK,HKD,ETF,,,,nan,nan,,,,,,
1961,1961,308.HK,CHINA TRAVEL INTERNATIONAL INVESTM,nan,HK,HKD,Common Stock,,,,nan,nan,,,,,,
1962,1962,3081.HK,Value Gold ETF,nan,HK,HKD,ETF,HK0000071313,,,nan,nan,,,,,,
1963,1963,3082.HK,Xtrackers - MSCI Malaysia UCITS ETF,nan,HK,HKD,ETF,,,,nan,nan,,,,,,
1964,1964,3086.HK,BMO NASDAQ 100 HKD,nan,HK,HKD,ETF,,,,nan,nan,,,,,,
1965,1965,3087.HK,Xtrackers FTSE Vietnam Swap UCITS ETF 1C,nan,HK,HKD,ETF,,,,nan,nan,,,,,,
1966,1966,3088.HK,ChinaAMC Hang Seng TECH Index ETF,nan,HK,HKD,ETF,,,,nan,nan,,,,,,
1967,1967,3091.HK,Nikko AM Hong Kong Exchange Traded Funds Series - NikkoAM E-Games Active ETF,nan,HK,HKD,ETF,HK0000601036,,,nan,nan,,,,,,
1968,1968,3092.HK,db x-trackers MSCI Thailand UCITS 2C,nan,HK,HKD,ETF,,,,nan,nan,,,,,,
1969,1969,3093.HK,China International Capital Corporation Hong Kong - CSI Select 100 ETF Fund,nan,HK,HKD,ETF,HK0000458304,,,nan,nan,,,,,,
1970,1970,3097.HK,Global X S&P Crude Oil Futures Enhanced ER ETF,nan,HK,HKD,ETF,,,,nan,nan,,,,,,
1971,1971,3099.HK,db x-trackers MSCI Indonesia UCITS 2C,nan,HK,HKD,ETF,,,,nan,nan,,,,,,
1972,1972,3099-OL.HK,X DBMSCIINDO,nan,HK,HKD,Common Stock,,,,nan,nan,,,,,,
1973,1973,3100.HK,E Fund CSI 100 A-Share,nan,HK,HKD,ETF,,,,nan,nan,,,,,,
1974,1974,3110.HK,Global X Hang Seng High Dividend Yield,nan,HK,HKD,ETF,,,,nan,nan,,,,,,
1975,1975,3115.HK,iShares Core Hang Seng,nan,HK,HKD,ETF,,,,nan,nan,,,,,,
1976,1976,3118.HK,Harvest MSCI China A,nan,HK,HKD,ETF,,,,nan,nan,,,,,,
1977,1977,312.HK,SHIRBLE DEPARTMENT STORE HOLDINGS,nan,HK,HKD,Common Stock,,,,nan,nan,,,,,,
1978,1978,3121.HK,ChinaAMC MSCI Asia Pacific Real Estate ETF,nan,HK,HKD,ETF,,,,nan,nan,,,,,,
1979,1979,3122.HK,CSOP China Ultra Short-Term Bond,nan,HK,HKD,ETF,,,,nan,nan,,,,,,
1980,1980,3127.HK,Global X CSI 300 HKD,nan,HK,HKD,ETF,,,,nan,nan,,,,,,
1981,1981,3128.HK,Hang Seng China A Industry Top,nan,HK,HKD,ETF,,,,nan,nan,,,,,,
1982,1982,3141.HK,ChinaAMC Asia USD Investment Grade,nan,HK,HKD,ETF,HK0000221389,,,nan,nan,,,,,,
1983,1983,3145.HK,ChinaAMC Asia High Dividend ETF,nan,HK,HKD,ETF,,,,nan,nan,,,,,,
1984,1984,3147.HK,CSOP SZSE ChiNext ETF,nan,HK,HKD,ETF,,,,nan,nan,,,,,,
1985,1985,3149.HK,CSOP MSCI China A International,nan,HK,HKD,ETF,,,,nan,nan,,,,,,
1986,1986,315.HK,SMARTONE TELECOMMUNICATIONS HOLDIN,nan,HK,HKD,Common Stock,,,,nan,nan,,,,,,
1987,1987,3157.HK,ChinaAMC Hang Seng Stock Connect Hong Kong SmallCap Index ETF,nan,HK,HKD,ETF,,,,nan,nan,,,,,,
1988,1988,3160.HK,ChinaAMC MSCI Japan Hedged to USD ETF,nan,HK,HKD,ETF,,,,nan,nan,,,,,,
1989,1989,3162.HK,ISHARESMSCIAI,nan,HK,HKD,ETF,,,,nan,nan,,,,,,
1990,1990,3165.HK,ChinaAMC MSCI Europe Quality Hedged to,nan,HK,HKD,ETF,,,,nan,nan,,,,,,
1991,1991,3167.HK,CSOP ETF Series - CSOP S&P New China Sectors ETF,nan,HK,HKD,ETF,,,,nan,nan,,,,,,
1992,1992,3173.HK,Premia ETF Series - Premia CSI Caixin China New Economy ETF,nan,HK,HKD,ETF,HK0000366184,,,nan,nan,,,,,,
1993,1993,3175.HK,Samsung S&P GSCI Crude Oil ER Futures ETF,nan,HK,HKD,ETF,,,,nan,nan,,,,,,
1994,1994,3181.HK,Premia Etf Series - Premia Asia Innovative Technology Etf,nan,HK,HKD,ETF,HK0000433398,,,nan,nan,,,,,,
1995,1995,3188.HK,ChinaAMC CSI 300 Index ETF,nan,HK,HKD,ETF,,,,nan,nan,,,,,,
1996,1996,3191.HK,Global X China Semiconductor ETF,nan,HK,HKD,ETF,,,,nan,nan,,,,,,
1997,1997,3199.HK,CSOP China 5-Year Treasury Bond,nan,HK,HKD,ETF,,,,nan,nan,,,,,,
1998,1998,321.HK,TEXWINCA HOLDINGS LTD,nan,HK,HKD,Common Stock,,,,nan,nan,,,,,,
1999,1999,323.HK,MAANSHAN IRON AND STEEL LTD H,nan,HK,HKD,Common Stock,,,,nan,nan,,,,,,
2000,2000,327.HK,PAX GLOBAL TECHNOLOGY LTD,nan,HK,HKD,Common Stock,,,,nan,nan,,,,,,
2001,2001,330.HK,ESPRIT HOLDINGS LTD,nan,HK,HKD,Common Stock,,,,nan,nan,,,,,,
2002,2002,3300.HK,China Glass Holdings Limited,nan,HK,HKD,Common Stock,BMG2111H1236,,,nan,nan,,,,,,
2003,2003,3301.HK,Ronshine China Holdings Limited,nan,HK,HKD,Common Stock,KYG763681023,,,nan,nan,,,,,,
2004,2004,3302.HK,Kinergy Corporation Ltd,nan,HK,HKD,Common Stock,SGXZ22036768,,,nan,nan,,,,,,
2005,2005,3303.HK,Jutal Offshore Oil Services Limited,nan,HK,HKD,Common Stock,KYG520771075,,,nan,nan,,,,,,
2006,2006,3306.HK,JNBY Design Limited,nan,HK,HKD,Common Stock,KYG550441045,,,nan,nan,,,,,,
2007,2007,3308.HK,Golden Eagle Retail Group Limited,nan,HK,HKD,Common Stock,KYG3958R1092,,,nan,nan,,,,,,
2008,2008,3309.HK,C-MER Eye Care Holdings Limited,nan,HK,HKD,Common Stock,KYG2R51A1053,,,nan,nan,,,,,,
2009,2009,3311.HK,China State Construction International Holdings Limited,nan,HK,HKD,Common Stock,KYG216771363,,,nan,nan,,,,,,
2010,2010,3313.HK,ArtGo Holdings Limited,nan,HK,HKD,Common Stock,KYG0509A1067,,,nan,nan,,,,,,
2011,2011,3315.HK,Goldpac Group Limited,nan,HK,HKD,Common Stock,HK0000172855,,,nan,nan,,,,,,
2012,2012,3316.HK,Binjiang Service Group Co. Ltd,nan,HK,HKD,Common Stock,KYG1122A1013,,,nan,nan,,,,,,
2013,2013,3318.HK,China Boton Group Company Limited,nan,HK,HKD,Common Stock,KYG2152H1074,,,nan,nan,,,,,,
2014,2014,3319.HK,A-Living Smart City Services Co. Ltd,nan,HK,HKD,Common Stock,CNE100002RY5,,,nan,nan,,,,,,
2015,2015,3320.HK,China Resources Pharmaceutical Group Limited,nan,HK,HKD,Common Stock,HK0000311099,,,nan,nan,,,,,,
2016,2016,3321.HK,Wai Hung Group Holdings Limited,nan,HK,HKD,Common Stock,KYG9428A1058,,,nan,nan,,,,,,
2017,2017,3322.HK,Win Hanverky Holdings Limited,nan,HK,HKD,Common Stock,KYG9716W1087,,,nan,nan,,,,,,
2018,2018,3323.HK,China National Building Material Company Limited,China,HK,HKD,Common Stock,CNE1000002N9,,,Building Materials,Basic Materials,0.67373437,73972932608,9.007273,10.383214,0.055630002,0.25964
2019,2019,3326.HK,Perfect Group International Holdings Limited,nan,HK,HKD,Common Stock,KYG700671145,,,nan,nan,,,,,,
2020,2020,3328.HK,Bank of Communications Co. Ltd,nan,HK,HKD,Common Stock,CNE100000205,,,nan,nan,,,,,,
2021,2021,3329.HK,BOCOM International Holdings Company Limited,nan,HK,HKD,Common Stock,HK0000337987,,,nan,nan,,,,,,
2022,2022,3330.HK,Lingbao Gold Group Company Ltd,nan,HK,HKD,Common Stock,CNE1000001H3,,,nan,nan,,,,,,
2023,2023,3331.HK,Vinda International Holdings Limited,nan,HK,HKD,Common Stock,KYG9361V1086,,,nan,nan,,,,,,
2024,2024,3332.HK,Nanjing Sinolife United Company Limited,nan,HK,HKD,Common Stock,CNE100001S08,,,nan,nan,,,,,,
2025,2025,3333.HK,China Evergrande Group,China,HK,HKD,Common Stock,KYG2119W1069,,,Real Estate—Development,Real Estate,0.38842827,56897171456,6.990857,12.004357,0.01592,0.24170999
2026,2026,3336.HK,Ju Teng International Holdings Limited,nan,HK,HKD,Common Stock,KYG521051063,,,nan,nan,,,,,,
2027,2027,3337.HK,Anton Oilfield Services Group,nan,HK,HKD,Common Stock,KYG039991024,,,nan,nan,,,,,,
2028,2028,3339.HK,Lonking Holdings Limited,nan,HK,HKD,Common Stock,KYG5636C1078,,,nan,nan,,,,,,
2029,2029,3339-OL.HK,LONKING,nan,HK,HKD,Common Stock,,,,nan,nan,,,,,,
2030,2030,3344.HK,GTI Holdings Limited,nan,HK,HKD,Common Stock,KYG416571001,,,nan,nan,,,,,,
2031,2031,3347.HK,Hangzhou Tigermed Consulting Co. Ltd,nan,HK,HKD,Common Stock,CNE1000040M1,,,nan,nan,,,,,,
2032,2032,3348.HK,China PengFei Group Limited,nan,HK,HKD,Common Stock,KYG2164M1024,,,nan,nan,,,,,,
2033,2033,3358.HK,Bestway Global Holding Inc,nan,HK,HKD,Common Stock,KYG1069R1092,,,nan,nan,,,,,,
2034,2034,3360.HK,Far East Horizon Limited,nan,HK,HKD,Common Stock,HK0000077468,,,nan,nan,,,,,,
2035,2035,3363.HK,Zhengye International Holdings Company Limited,nan,HK,HKD,Common Stock,BMG989231086,,,nan,nan,,,,,,
2036,2036,3363-OL.HK,ZHENGYE INT'L,nan,HK,HKD,Common Stock,,,,nan,nan,,,,,,
2037,2037,3366.HK,Overseas Chinese Town (Asia) Holdings Limited,nan,HK,HKD,Common Stock,KYG684581013,,,nan,nan,,,,,,
2038,2038,3368.HK,Parkson Retail Group Limited,nan,HK,HKD,Common Stock,KYG693701156,,,nan,nan,,,,,,
2039,2039,3369.HK,Qinhuangdao Port Co. Ltd,nan,HK,HKD,Common Stock,CNE100001QR3,,,nan,nan,,,,,,
2040,2040,337.HK,GREENLAND HONG KONG HOLDINGS LTD,nan,HK,HKD,Common Stock,,,,nan,nan,,,,,,
2041,2041,3377.HK,Sino-Ocean Group Holding Limited,nan,HK,HKD,Common Stock,HK3377040226,,,nan,nan,,,,,,
2042,2042,3378.HK,Xiamen International Port Co. Ltd,nan,HK,HKD,Common Stock,CNE1000004N5,,,nan,nan,,,,,,
2043,2043,338.HK,SINOPEC SHANGHAI PETROCHEMICAL LTD,nan,HK,HKD,Common Stock,,,,nan,nan,,,,,,
2044,2044,3380.HK,Logan Group Company Limited,nan,HK,HKD,Common Stock,KYG555551095,,,nan,nan,,,,,,
2045,2045,3382.HK,Tianjin Port Development Holdings Limited,nan,HK,HKD,Common Stock,KYG886801060,,,nan,nan,,,,,,
2046,2046,3383.HK,Agile Group Holdings Limited,nan,HK,HKD,Common Stock,KYG011981035,,,nan,nan,,,,,,
2047,2047,3389.HK,Hengdeli Holdings Limited,nan,HK,HKD,Common Stock,KYG450481083,,,nan,nan,,,,,,
2048,2048,3390.HK,Tycoon Group Holdings Limited,nan,HK,HKD,Common Stock,KYG9143T1085,,,nan,nan,,,,,,
2049,2049,3393.HK,Wasion Holdings Limited,nan,HK,HKD,Common Stock,KYG9463P1081,,,nan,nan,,,,,,
2050,2050,3393-OL.HK,WASION GROUP,nan,HK,HKD,Common Stock,,,,nan,nan,,,,,,
2051,2051,3395.HK,Persta Resources Inc,nan,HK,HKD,Common Stock,CA71535Q1072,,,nan,nan,,,,,,
2052,2052,3396.HK,Legend Holdings Corporation,nan,HK,HKD,Common Stock,CNE100001ZT0,,,nan,nan,,,,,,
2053,2053,3398.HK,China Ting Group Holdings Limited,nan,HK,HKD,Common Stock,KYG8439J1058,,,nan,nan,,,,,,
2054,2054,3399.HK,Guangdong Yueyun Transportation Company Limited,nan,HK,HKD,Common Stock,CNE100000361,,,nan,nan,,,,,,
2055,2055,3399-OL.HK,YUEYUN TRANS,nan,HK,HKD,Common Stock,,,,nan,nan,,,,,,
2056,2056,341.HK,CAFE DE CORAL HOLDINGS LTD,nan,HK,HKD,Common Stock,,,,nan,nan,,,,,,
2057,2057,342.HK,NEWOCEAN ENERGY HOLDINGS LTD,nan,HK,HKD,Common Stock,,,,nan,nan,,,,,,
2058,2058,35.HK,FAR EAST CONSORTIUM INTERNATIONAL,nan,HK,HKD,Common Stock,,,,nan,nan,,,,,,
2059,2059,354.HK,CHINASOFT INTERNATIONAL LTD,nan,HK,HKD,Common Stock,,,,nan,nan,,,,,,
2060,2060,357.HK,HAINAN MEILAN INTERNATIONAL AIRPOR,nan,HK,HKD,Common Stock,,,,nan,nan,,,,,,
2061,2061,358.HK,JIANGXI COPPER LTD H,nan,HK,HKD,Common Stock,,,,nan,nan,,,,,,
2062,2062,3600.HK,Modern Dental Group Limited,nan,HK,HKD,Common Stock,KYG618201092,,,nan,nan,,,,,,
2063,2063,3601.HK,360 Ludashi Holdings Limited,nan,HK,HKD,Common Stock,KYG8R49A1078,,,nan,nan,,,,,,
2064,2064,3603.HK,Xinji Shaxi Group Co. Ltd,nan,HK,HKD,Common Stock,KYG9830L1032,,,nan,nan,,,,,,
2065,2065,3606.HK,Fuyao Glass Industry Group Co. Ltd,nan,HK,HKD,Common Stock,CNE100001TR7,,,nan,nan,,,,,,
2066,2066,3608.HK,Yongsheng Advanced Materials Company Limited,nan,HK,HKD,Common Stock,KYG9845G1073,,,nan,nan,,,,,,
2067,2067,3608-OL.HK,YONGSHENG MAT,nan,HK,HKD,Common Stock,,,,nan,nan,,,,,,
2068,2068,3613.HK,Beijing Tong Ren Tang Chinese Medicine Company Limited,nan,HK,HKD,Common Stock,HK0000145638,,,nan,nan,,,,,,
2069,2069,3616.HK,Ever Reach Group (Holdings) Company Limited,nan,HK,HKD,Common Stock,KYG322701031,,,nan,nan,,,,,,
2070,2070,3618.HK,Chongqing Rural Commercial Bank Co. Ltd,nan,HK,HKD,Common Stock,CNE100000X44,,,nan,nan,,,,,,
2071,2071,3623.HK,China Success Finance Group Holdings Limited,nan,HK,HKD,Common Stock,KYG216891070,,,nan,nan,,,,,,
2072,2072,3626.HK,Hang Sang (Siu Po) International Holding Company Limited,nan,HK,HKD,Common Stock,KYG4288S1066,,,nan,nan,,,,,,
2073,2073,3628.HK,RENHENG Enterprise Holdings Limited,nan,HK,HKD,Common Stock,KYG750051198,,,nan,nan,,,,,,
2074,2074,363.HK,SHANGHAI INDUSTRIAL HOLDINGS LTD,nan,HK,HKD,Common Stock,,,,nan,nan,,,,,,
2075,2075,3633.HK,Zhongyu Gas Holdings Limited,nan,HK,HKD,Common Stock,KYG9891U1334,,,nan,nan,,,,,,
2076,2076,3633-OL.HK,ZHONGYU GAS,nan,HK,HKD,Common Stock,,,,nan,nan,,,,,,
2077,2077,3636.HK,Poly Culture Group Corporation Limited,nan,HK,HKD,Common Stock,CNE100001S81,,,nan,nan,,,,,,
2078,2078,3638.HK,Huabang Technology Holdings Limited,nan,HK,HKD,Common Stock,KYG4644E1061,,,nan,nan,,,,,,
2079,2079,3639.HK,Yida China Holdings Limited,nan,HK,HKD,Common Stock,KYG9843H1074,,,nan,nan,,,,,,
2080,2080,3639-OL.HK,YIDA CHINA,nan,HK,HKD,Common Stock,,,,nan,nan,,,,,,
2081,2081,3662.HK,Aoyuan Healthy Life Group Company Limited,nan,HK,HKD,Common Stock,KYG0404F1019,,,nan,nan,,,,,,
2082,2082,3666.HK,TANSH Global Food Group Co. Ltd,nan,HK,HKD,Common Stock,KYG8673P1063,,,nan,nan,,,,,,
2083,2083,3666-OL.HK,XIAO NAN GUO,nan,HK,HKD,Common Stock,,,,nan,nan,,,,,,
2084,2084,3668.HK,Yancoal Australia Ltd,nan,HK,HKD,Common Stock,AU000000YAL0,,,nan,nan,,,,,,
2085,2085,3669.HK,China Yongda Automobiles Services Holdings Limited,nan,HK,HKD,Common Stock,KYG2162W1024,,,nan,nan,,,,,,
2086,2086,3669-OL.HK,YONGDA AUTO,nan,HK,HKD,Common Stock,,,,nan,nan,,,,,,
2087,2087,3678.HK,Holly Futures Co. Ltd,nan,HK,HKD,Common Stock,CNE1000023S4,,,nan,nan,,,,,,
2088,2088,3680.HK,Suoxinda Holdings Limited,nan,HK,HKD,Common Stock,KYG8587G1010,,,nan,nan,,,,,,
2089,2089,3681.HK,SinoMab BioScience Limited,nan,HK,HKD,Common Stock,HK0000544194,,,nan,nan,,,,,,
2090,2090,3683.HK,Great Harvest Maeta Group Holdings Limited,nan,HK,HKD,Common Stock,KYG4163E1070,,,nan,nan,,,,,,
2091,2091,3686.HK,Clifford Modern Living Holdings Limited,nan,HK,HKD,Common Stock,KYG2204M1042,,,nan,nan,,,,,,
2092,2092,3688.HK,Top Spring International Holdings Limited,nan,HK,HKD,Common Stock,KYG892541098,,,nan,nan,,,,,,
2093,2093,3689.HK,Guangdong Kanghua Healthcare Co. Ltd,nan,HK,HKD,Common Stock,CNE100002B55,,,nan,nan,,,,,,
2094,2094,3690.HK,Meituan,China,HK,HKD,Common Stock,KYG596691041,,,Internet Retail,Consumer Cyclical,13.87117,1359385591808,244.29445,299.26285,0.010720001,0.26232
2095,2095,3692.HK,Hansoh Pharmaceutical Group Company Limited,nan,HK,HKD,Common Stock,KYG549581067,,,nan,nan,,,,,,
2096,2096,3698.HK,Huishang Bank Corporation Limited,nan,HK,HKD,Common Stock,CNE100001QP7,,,nan,nan,,,,,,
2097,2097,3699.HK,Everbright Grand China Assets Limited,nan,HK,HKD,Common Stock,KYG3222R1092,,,nan,nan,,,,,,
2098,2098,3700.HK,Inke Limited,nan,HK,HKD,Common Stock,KYG4809C1015,,,nan,nan,,,,,,
2099,2099,3708.HK,China Supply Chain Holdings Limited,nan,HK,HKD,Common Stock,KYG983421192,,,nan,nan,,,,,,
2100,2100,3709.HK,EEKA Fashion Holdings Limited,nan,HK,HKD,Common Stock,KYG539641053,,,nan,nan,,,,,,
2101,2101,3718.HK,Beijing Enterprises Urban Resources Group Limited,nan,HK,HKD,Common Stock,KYG0958F1019,,,nan,nan,,,,,,
2102,2102,3728.HK,Ching Lee Holdings Limited,nan,HK,HKD,Common Stock,KYG2118S1066,,,nan,nan,,,,,,
2103,2103,3737.HK,Zhongzhi Pharmaceutical Holdings Limited,nan,HK,HKD,Common Stock,KYG989611085,,,nan,nan,,,,,,
2104,2104,3738.HK,Vobile Group Limited,nan,HK,HKD,Common Stock,KYG9390R1103,,,nan,nan,,,,,,
2105,2105,3759.HK,Pharmaron Beijing Co. Ltd,nan,HK,HKD,Common Stock,CNE100003PG4,,,nan,nan,,,,,,
2106,2106,3768.HK,Kunming Dianchi Water Treatment Co. Ltd,nan,HK,HKD,Common Stock,CNE100002BH4,,,nan,nan,,,,,,
2107,2107,3773.HK,NNK Group Limited,nan,HK,HKD,Common Stock,KYG654091076,,,nan,nan,,,,,,
2108,2108,3778.HK,China Weaving Materials Holdings Limited,nan,HK,HKD,Common Stock,KYG2116A1076,,,nan,nan,,,,,,
2109,2109,3778-OL.HK,CHINA WEAVING,nan,HK,HKD,Common Stock,,,,nan,nan,,,,,,
2110,2110,3788.HK,China Hanking Holdings Limited,nan,HK,HKD,Common Stock,KYG2115G1055,,,nan,nan,,,,,,
2111,2111,3789.HK,Royal Deluxe Holdings Limited,nan,HK,HKD,Common Stock,KYG7852R1074,,,nan,nan,,,,,,
2112,2112,3798.HK,Homeland Interactive Technology Ltd,nan,HK,HKD,Common Stock,KYG6647P1037,,,nan,nan,,,,,,
2113,2113,3799.HK,Dali Foods Group Company Limited,nan,HK,HKD,Common Stock,KYG2743Y1061,,,nan,nan,,,,,,
2114,2114,38.HK,FIRST TRACTOR LTD H,nan,HK,HKD,Common Stock,,,,nan,nan,,,,,,
2115,2115,3808.HK,Sinotruk (Hong Kong) Limited,nan,HK,HKD,Common Stock,HK3808041546,,,nan,nan,,,,,,
2116,2116,3813.HK,Pou Sheng International (Holdings) Limited,nan,HK,HKD,Common Stock,BMG7208D1092,,,nan,nan,,,,,,
2117,2117,3816.HK,KFM Kingdom Holdings Limited,nan,HK,HKD,Common Stock,KYG525551027,,,nan,nan,,,,,,
2118,2118,3818.HK,China Dongxiang (Group) Co. Ltd,nan,HK,HKD,Common Stock,KYG2112Y1098,,,nan,nan,,,,,,
2119,2119,382.HK,EDVANTAGE GROUP HOLDINGS LTD,nan,HK,HKD,Common Stock,,,,nan,nan,,,,,,
2120,2120,3822.HK,Sam Woo Construction Group Limited,nan,HK,HKD,Common Stock,KYG7785L1023,,,nan,nan,,,,,,
2121,2121,3828.HK,Ming Fai International Holdings Limited,nan,HK,HKD,Common Stock,KYG6141X1079,,,nan,nan,,,,,,
2122,2122,3830.HK,Kiddieland International Limited,nan,HK,HKD,Common Stock,KYG5259B1059,,,nan,nan,,,,,,
2123,2123,3833.HK,Xinjiang Xinxin Mining Industry Co. Ltd,nan,HK,HKD,Common Stock,CNE1000007G2,,,nan,nan,,,,,,
2124,2124,3836.HK,China Harmony Auto Holding Limited,nan,HK,HKD,Common Stock,KYG2118N1079,,,nan,nan,,,,,,
2125,2125,3838.HK,China Starch Holdings Limited,nan,HK,HKD,Common Stock,KYG2161A1195,,,nan,nan,,,,,,
2126,2126,3839.HK,Chia Tai Enterprises International Limited,nan,HK,HKD,Common Stock,BMG2151A1036,,,nan,nan,,,,,,
2127,2127,3848.HK,Wealthy Way Group Limited,nan,HK,HKD,Common Stock,KYG719721063,,,nan,nan,,,,,,
2128,2128,3860.HK,Speed Apparel Holding Limited,nan,HK,HKD,Common Stock,KYG8340R1056,,,nan,nan,,,,,,
2129,2129,3866.HK,Bank of Qingdao Co. Ltd,nan,HK,HKD,Common Stock,CNE100002391,,,nan,nan,,,,,,
2130,2130,3868.HK,Xinyi Energy Holdings Limited,nan,HK,HKD,Common Stock,VGG9833A1049,,,nan,nan,,,,,,
2131,2131,3869.HK,Hospital Corporation of China Limited,nan,HK,HKD,Common Stock,KYG4612W1042,,,nan,nan,,,,,,
2132,2132,3877.HK,CSSC (Hong Kong) Shipping Company Limited,nan,HK,HKD,Common Stock,HK0000504214,,,nan,nan,,,,,,
2133,2133,3878.HK,Vicon Holdings Limited,nan,HK,HKD,Common Stock,KYG9362W1050,,,nan,nan,,,,,,
2134,2134,3882.HK,Sky Light Holdings Limited,nan,HK,HKD,Common Stock,KYG8191M1069,,,nan,nan,,,,,,
2135,2135,3883.HK,China Aoyuan Group Limited,nan,HK,HKD,Common Stock,KYG2112H1065,,,nan,nan,,,,,,
2136,2136,3888.HK,Kingsoft Corporation Limited,Hong Kong,HK,HKD,Common Stock,KYG5264Y1089,,,Electronic Gaming & Multimedia,Communication Services,1.6226493,42614444032,38.28611,51.1975,1.6975,0.83956003
2137,2137,3889.HK,Global Sweeteners Holdings Limited,nan,HK,HKD,Common Stock,KYG3932Q1029,,,nan,nan,,,,,,
2138,2138,3893.HK,Crosstec Group Holdings Limited,nan,HK,HKD,Common Stock,KYG257501117,,,nan,nan,,,,,,
2139,2139,3898.HK,Zhuzhou CRRC Times Electric Co. Ltd,nan,HK,HKD,Common Stock,CNE1000004X4,,,nan,nan,,,,,,
2140,2140,3899.HK,CIMC Enric Holdings Limited,nan,HK,HKD,Common Stock,KYG2198S1093,,,nan,nan,,,,,,
2141,2141,3900.HK,Greentown China Holdings Limited,nan,HK,HKD,Common Stock,KYG4100M1050,,,nan,nan,,,,,,
2142,2142,3903.HK,Hanhua Financial Holding Co. Ltd,nan,HK,HKD,Common Stock,CNE100001S99,,,nan,nan,,,,,,
2143,2143,3908.HK,China International Capital Corporation Limited,nan,HK,HKD,Common Stock,CNE100002359,,,nan,nan,,,,,,
2144,2144,3913.HK,KWG Living Group Holdings Limited,nan,HK,HKD,Common Stock,KYG5322R1039,,,nan,nan,,,,,,
2145,2145,3918.HK,NagaCorp Ltd,nan,HK,HKD,Common Stock,KYG6382M1096,,,nan,nan,,,,,,
2146,2146,3919.HK,Golden Power Group Holdings Limited,nan,HK,HKD,Common Stock,KYG3959Y1035,,,nan,nan,,,,,,
2147,2147,3928.HK,S&T Holdings Limited,nan,HK,HKD,Common Stock,KYG773821023,,,nan,nan,,,,,,
2148,2148,3933.HK,The United Laboratories International Holdings Limited,Hong Kong,HK,HKD,Common Stock,KYG8813K1085,,,Drug Manufacturers—General,Healthcare,1.1837608,10195760128,5.7127776,6.1736426,0.08014,0.43388
2149,2149,3938.HK,LFG Investment Holdings Limited,nan,HK,HKD,Common Stock,KYG5471A1094,,,nan,nan,,,,,,
2150,2150,3939.HK,Wanguo International Mining Group Limited,nan,HK,HKD,Common Stock,KYG9430L1077,,,nan,nan,,,,,,
2151,2151,3948.HK,Inner Mongolia Yitai Coal Co. Ltd,nan,HK,HKD,Common Stock,CNE100001FW6,,,nan,nan,,,,,,
2152,2152,3948-OL.HK,YITAI COAL,nan,HK,HKD,Common Stock,,,,nan,nan,,,,,,
2153,2153,3958.HK,Orient Securities Company Limited,nan,HK,HKD,Common Stock,CNE1000027F2,,,nan,nan,,,,,,
2154,2154,3963.HK,China Rongzhong Financial Holdings Company Limited,nan,HK,HKD,Common Stock,KYG2119M1087,,,nan,nan,,,,,,
2155,2155,3968.HK,China Merchants Bank Co. Ltd,China,HK,HKD,Common Stock,CNE1000002M1,,,Banks—Regional,Financial Services,2.3424652,1612718276608,62.775715,63.834286,0.44405997,0.0
2156,2156,3969.HK,China Railway Signal & Communication Corporation Limited,nan,HK,HKD,Common Stock,CNE1000021L3,,,nan,nan,,,,,,
2157,2157,3978.HK,China Beststudy Education Group,nan,HK,HKD,Common Stock,KYG2121W1024,,,nan,nan,,,,,,
2158,2158,3983.HK,China BlueChemical Ltd,nan,HK,HKD,Common Stock,CNE1000002D0,,,nan,nan,,,,,,
2159,2159,3988.HK,Bank of China Limited,nan,HK,HKD,Common Stock,CNE1000001Z5,,,nan,nan,,,,,,
2160,2160,3989.HK,Capital Environment Holdings Limited,nan,HK,HKD,Common Stock,KYG1941T1094,,,nan,nan,,,,,,
2161,2161,3990.HK,Midea Real Estate Holding Limited,nan,HK,HKD,Common Stock,KYG609201085,,,nan,nan,,,,,,
2162,2162,3991.HK,Changhong Jiahua Holdings Limited,nan,HK,HKD,Common Stock,BMG2042K1045,,,nan,nan,,,,,,
2163,2163,3992.HK,Creative Enterprise Holdings Limited,nan,HK,HKD,Common Stock,KYG251801034,,,nan,nan,,,,,,
2164,2164,3993.HK,China Molybdenum Co. Ltd,nan,HK,HKD,Common Stock,CNE100000114,,,nan,nan,,,,,,
2165,2165,3996.HK,China Energy Engineering Corporation Limited,nan,HK,HKD,Common Stock,CNE1000023C8,,,nan,nan,,,,,,
2166,2166,3998.HK,Bosideng International Holdings Limited,nan,HK,HKD,Common Stock,KYG126521064,,,nan,nan,,,,,,
2167,2167,3999.HK,DaChan Food (Asia) Limited,nan,HK,HKD,Common Stock,KYG261441086,,,nan,nan,,,,,,
2168,2168,400.HK,COGOBUY,nan,HK,HKD,Common Stock,,,,nan,nan,,,,,,
2169,2169,405.HK,YUEXIU REAL ESTATE INVESTMENT TRUS,nan,HK,HKD,Common Stock,,,,nan,nan,,,,,,
2170,2170,41.HK,GREAT EAGLE HOLDINGS LTD,nan,HK,HKD,Common Stock,,,,nan,nan,,,,,,
2171,2171,410.HK,SOHO CHINA LTD,nan,HK,HKD,Common Stock,,,,nan,nan,,,,,,
2172,2172,425.HK,MINTH GROUP LTD,nan,HK,HKD,Common Stock,,,,nan,nan,,,,,,
2173,2173,43.HK,CP POKPHAND LTD,nan,HK,HKD,Common Stock,,,,nan,nan,,,,,,
2174,2174,435.HK,SUNLIGHT REAL ESTATE INVESTMENT TR,nan,HK,HKD,Common Stock,,,,nan,nan,,,,,,
2175,2175,440.HK,DAH SING FINANCIAL HOLDINGS LTD,nan,HK,HKD,Common Stock,,,,nan,nan,,,,,,
2176,2176,45.HK,HONG KONG AND SHANGHAI HOTELS LTD,nan,HK,HKD,Common Stock,,,,nan,nan,,,,,,
2177,2177,451.HK,GCL NEW ENERGY HOLDINGS LTD,nan,HK,HKD,Common Stock,,,,nan,nan,,,,,,
2178,2178,460.HK,SIHUAN PHARMACEUTICAL HOLDINGS GRO,nan,HK,HKD,Common Stock,,,,nan,nan,,,,,,
2179,2179,468.HK,GREATVIEW ASEPTIC PACKAGING COMPAN,nan,HK,HKD,Common Stock,,,,nan,nan,,,,,,
2180,2180,488.HK,LAI SUN DEVELOPMENT LTD,nan,HK,HKD,Common Stock,,,,nan,nan,,,,,,
2181,2181,496.HK,KASEN INTERNATIONAL HLDGS LTD,nan,HK,HKD,Common Stock,,,,nan,nan,,,,,,
2182,2182,497.HK,CSI PROPERTIES LTD,nan,HK,HKD,Common Stock,,,,nan,nan,,,,,,
2183,2183,506.HK,CHINA FOODS LTD,nan,HK,HKD,Common Stock,,,,nan,nan,,,,,,
2184,2184,511.HK,TELEVISION BROADCASTS LTD,nan,HK,HKD,Common Stock,,,,nan,nan,,,,,,
2185,2185,512.HK,CH GRAND PHARM & HEALTHCARE HLDGS,nan,HK,HKD,Common Stock,,,,nan,nan,,,,,,
2186,2186,517.HK,COSCO SHIPPING INTERNATIONAL (HONG,nan,HK,HKD,Common Stock,,,,nan,nan,,,,,,
2187,2187,52.HK,FAIRWOOD HOLDINGS LTD,nan,HK,HKD,Common Stock,,,,nan,nan,,,,,,
2188,2188,520.HK,XIABUXIABU CATERING MANAGEMENT (CH,nan,HK,HKD,Common Stock,,,,nan,nan,,,,,,
2189,2189,535.HK,GEMDALE PROPERTIES AND INVESTMENT,nan,HK,HKD,Common Stock,,,,nan,nan,,,,,,
2190,2190,538.HK,AJISEN (CHINA) HOLDINGS LTD,nan,HK,HKD,Common Stock,,,,nan,nan,,,,,,
2191,2191,546.HK,FUFENG GROUP LTD,nan,HK,HKD,Common Stock,,,,nan,nan,,,,,,
2192,2192,563.HK,SHANGHAI INDUSTRIAL URBAN DEVELOPM,nan,HK,HKD,Common Stock,,,,nan,nan,,,,,,
2193,2193,564.HK,ZHENGZHOU COAL MINING MACHINERY GR,nan,HK,HKD,Common Stock,,,,nan,nan,,,,,,
2194,2194,579.HK,BEIJING JINGNENG CLEAN ENERGY LTD,nan,HK,HKD,Common Stock,,,,nan,nan,,,,,,
2195,2195,581.HK,CHINA ORIENTAL LTD,nan,HK,HKD,Common Stock,,,,nan,nan,,,,,,
2196,2196,582.HK,LANDING INTERNATIONAL DEVELOPMENT,nan,HK,HKD,Common Stock,,,,nan,nan,,,,,,
2197,2197,586.HK,China Conch Venture Holdings Ltd,nan,HK,HKD,Common Stock,,,,nan,nan,,,,,,
2198,2198,588.HK,BEIJING NORTH STAR LTD H,nan,HK,HKD,Common Stock,,,,nan,nan,,,,,,
2199,2199,59.HK,SKYFAME REALTY HOLDINGS LTD,nan,HK,HKD,Common Stock,,,,nan,nan,,,,,,
